VIN,Year,Make,Model,Trim,Odometer,SpecialPrice,ExteriorColor,InteriorColor,Transmission,PhotoURLs,WebAdDescription,EquipmentCode,LatestPhotoModifiedDate
2T3BF4DV8CW209829,2012,Toyota,RAV4,Sport Utility 4D,157250,7590,Silver,,Automatic  4-Spd,https://imagesdl.dealercenter.net/1024/768/202601-5a298007c6b94b729a867732bed7a5c6.jpg https://imagesdl.dealercenter.net/1024/768/202601-9213b68711a34720ab99a5fc0d452135.jpg https://imagesdl.dealercenter.net/1024/768/202601-f49a4a8cb9f7422c8dad19753a65fe62.jpg https://imagesdl.dealercenter.net/1024/768/202601-f8a46f176deb4427b15c469140b39bd9.jpg https://imagesdl.dealercenter.net/1024/768/202601-d3e52eb887a5449db0206233151783a7.jpg https://imagesdl.dealercenter.net/1024/768/202601-55745d87022843dc91a9fc833720347c.jpg https://imagesdl.dealercenter.net/1024/768/202601-e9e8aeb12cac4131a134c34ea949158a.jpg https://imagesdl.dealercenter.net/1024/768/202601-01692222232d4cda80f745e064aeef30.jpg https://imagesdl.dealercenter.net/1024/768/202601-c20a3cee39c84ea79e529a55e2e66e56.jpg https://imagesdl.dealercenter.net/1024/768/202601-c81795f4448e4c25ba1cfb4ff094836f.jpg https://imagesdl.dealercenter.net/1024/768/202601-7d11474acf26489298be6ed51d70be14.jpg https://imagesdl.dealercenter.net/1024/768/202601-d7ff140420144a94879d1ece90e3cc01.jpg https://imagesdl.dealercenter.net/1024/768/202601-7fc52352b58e4c41961e2a17d032ebab.jpg https://imagesdl.dealercenter.net/1024/768/202601-7589cbc89b354ee9afb1f2f90142b6cd.jpg https://imagesdl.dealercenter.net/727/768/202601-92447f099dbc4621a1e1e1e1a130b365.jpg,2012 Toyota RAV4All wheel driveClean title ?Extremely reliable  decent SUVRuns and drives goodClean interior and exteriorGood maintenance historyEverything works as it shouldNice looking oem alloy wheels and good tiresFeel free to come for a test drive or show it to your mechanic,F&R Head Curtain Air Bags Dual Air Bags Stability Control Power Steering Side Air Bags Power Windows AM/FM Stereo 4-Cyl 2.5 Liter 4WD Bluetooth Wireless Tilt & Telescoping Wheel Rear Spoiler ABS (4-Wheel) Anti-Theft System Air Conditioning CD/MP3 (Single Disc) Cruise Control Steel Wheels Power Door Locks Keyless Entry Automatic 4-Spd Traction Control,1/14/2026 4:40:40 PM
5TDZA23C25S354287,2005,Toyota,Sienna,CE Minivan 4D,138750,3990,Blue,,Automatic,https://imagesdl.dealercenter.net/1024/768/202601-3064b1e9cfc0403c9256a46fda80ca6e.jpg https://imagesdl.dealercenter.net/1024/768/202601-ead6b6a8f6234d8a8b77ca64e4c1de84.jpg https://imagesdl.dealercenter.net/1024/768/202601-8eb38dcf390b48a18380a356db7cd5ec.jpg https://imagesdl.dealercenter.net/1024/768/202601-3896961571154647934e81d47a247542.jpg https://imagesdl.dealercenter.net/1024/768/202601-2c885a51b9df49a58552c7caeb4b14d7.jpg https://imagesdl.dealercenter.net/1024/768/202601-195b7de0aa8a42998f779a76fe5e3ef2.jpg https://imagesdl.dealercenter.net/1024/768/202601-2b70fafdfcb84b4f9a7fcd70940de393.jpg https://imagesdl.dealercenter.net/1024/768/202601-15390f27b1d74360819f7faae1ccbd94.jpg https://imagesdl.dealercenter.net/1024/768/202601-4e6bba7dec3d4a028851004980a8098c.jpg https://imagesdl.dealercenter.net/1024/768/202601-59afa4dc54d1493fbda0a3b3f9055e74.jpg https://imagesdl.dealercenter.net/1024/768/202601-922da9d343d947268d7e15e91de87630.jpg https://imagesdl.dealercenter.net/1024/768/202601-e1bfeea861494ac4afdda28cc8e6f185.jpg https://imagesdl.dealercenter.net/1024/768/202601-6c671befd43341b093b70a1f9124d00e.jpg https://imagesdl.dealercenter.net/1024/768/202601-67a76e51a6974b97abb4bdb4e82b96ef.jpg https://imagesdl.dealercenter.net/1024/768/202601-d58965e1a70d40a8a61bdc445af61679.jpg https://imagesdl.dealercenter.net/1024/768/202601-f5199fe083244326b3e35248377f3780.jpg https://imagesdl.dealercenter.net/1014/768/202601-9ea47fa1f5044d60b6c3d0483eed72d8.jpg,Toyota SiennaClean title ?Runs and drives goodNo rust issuesGreat good years tires are onGood brakesStrong engine and transmissionListed for a great priceIt needs 02 sensorIt will pass state inspectionFeel free to check in person or bringing your mechanicGood condition for a 20 years old car but don't expect brand new van,ABS (4-Wheel) FWD Air Conditioning Rear AM/FM Stereo V6 3.3 Liter Power Door Locks Power Windows Traction Control Side Air Bags Power Seat Steel Wheels Tilt Wheel CD/MP3 (Single Disc) Dual Air Bags Air Conditioning Cruise Control 7-Passenger Seating Power Steering Automatic,1/14/2026 8:20:46 PM
WA1ECCFS3HR006657,2017,Audi,Q3,Premium Sport Utility 4D,121200,8500,Black,,Auto  6-Spd w/Tiptronic,https://imagesdl.dealercenter.net/1024/768/202601-5b50a731ed4c447db19f8e115f10dd6e.jpg https://imagesdl.dealercenter.net/1024/768/202601-51e796c1e87140d681f960b77519996f.jpg https://imagesdl.dealercenter.net/1024/768/202601-553f3a2a84f748bbbd4e97870e54b4c2.jpg https://imagesdl.dealercenter.net/1024/768/202601-f7bc8edb14d34163952f90d31077612f.jpg https://imagesdl.dealercenter.net/1024/768/202601-ae22b67484954adb8f18a52f0c13750a.jpg https://imagesdl.dealercenter.net/1024/768/202601-8713aab8bbe9498e9862ff22942bc572.jpg https://imagesdl.dealercenter.net/1024/768/202601-fa6859750c8e4bc89de39806c925f63b.jpg https://imagesdl.dealercenter.net/1024/768/202601-51e7ec732522416e903322fc97c699a9.jpg https://imagesdl.dealercenter.net/1024/768/202601-031d08af2c8249fda411e4921c69d1ac.jpg https://imagesdl.dealercenter.net/1024/768/202601-ddd6eb4412f045d0a1f7788c7b04f1da.jpg https://imagesdl.dealercenter.net/1024/768/202601-e9abc6757dd14a7ca0cf7346323e5dd4.jpg https://imagesdl.dealercenter.net/1024/768/202601-8c3289b9dcb44b38b713702ef92fd915.jpg https://imagesdl.dealercenter.net/1024/768/202601-81adf87fb83e4bd08031bb283c9fb059.jpg https://imagesdl.dealercenter.net/1024/768/202601-3148e3c854e446d28b62b32dcef1c1b4.jpg https://imagesdl.dealercenter.net/1024/768/202601-13adbebad982454f9a005be2a43623b3.jpg https://imagesdl.dealercenter.net/1024/768/202601-2bf6f1dad34f4f6aa38a6d969bfda600.jpg https://imagesdl.dealercenter.net/1024/768/202601-756ee9616b9c4c2bacde8ba91bdfd75f.jpg https://imagesdl.dealercenter.net/1024/768/202601-2982e4b6c29c4474bf431940ba465bfb.jpg https://imagesdl.dealercenter.net/999/768/202601-c609f229c2c844eba0b19c39471fb101.jpg https://imagesdl.dealercenter.net/1024/768/202601-ba0d96925c3245d6b07961331ed40d21.jpg,2017 Audi Q3 Quattro Premium SportExceptionally well maintainedEven the timing chain was replaced not long ago120k milesFreshly detailedClean titleClean CarfaxNo accidentsRuns and drives like newOne of best Q3 on the market.Ready to go,Electronic Stability Control Hill Descent Control Traction Control CD/MP3 (Single Disc) SiriusXM Satellite Heated Seats Alloy Wheels Backup Camera Bluetooth Wireless Keyless Start Side Air Bags Cruise Control ABS (4-Wheel) Daytime Running Lights AM/FM/HD Radio F&R Head Curtain Air Bags 4-Cyl Turbo 2.0 Liter Dual Air Bags Electromechanical Steering Alarm System Power Door Locks Air Conditioning AWD Fog Lights F&R Parking Sensors Rear Spoiler Xenon Headlamps Auto 6-Spd w/Tiptronic Leather Dual Power Seats Power Windows Tilt & Telescoping Wheel Panorama Roof,1/15/2026 5:25:37 PM
5TBDT44186S506239,2006,Toyota,Tundra Double Cab,SR5 Pickup 4D 6 1/2 ft,204173,7499,Gray,,Automatic,https://imagesdl.dealercenter.net/1024/768/202601-8e8bfd0cb77241a08ff057a7fbdd17c4.jpg https://imagesdl.dealercenter.net/1024/768/202601-505c62b03d6d4a20bf7e23cf7e233334.jpg https://imagesdl.dealercenter.net/1024/768/202601-0fd2a27b8a174e7380c86acfdb56e297.jpg https://imagesdl.dealercenter.net/1024/768/202601-27822bc59efd4018b56750a870acbafa.jpg https://imagesdl.dealercenter.net/1024/768/202601-f98cfe44d3df4605bb0ba62cce1e4c46.jpg https://imagesdl.dealercenter.net/1024/768/202601-aa682b6153cd4087ad032551b3231d2e.jpg https://imagesdl.dealercenter.net/1024/768/202601-671f1a21b4d647b1be3da11f9bfe5c88.jpg https://imagesdl.dealercenter.net/1024/768/202601-69dab763aadb46dfbab81e84bc918bb7.jpg https://imagesdl.dealercenter.net/1024/768/202601-b9b75a9aba5a4a2f9f6a3cd36036df5c.jpg https://imagesdl.dealercenter.net/1024/768/202601-2b9bcb1322e245a2b762cdb9b5effc61.jpg https://imagesdl.dealercenter.net/1024/768/202601-00ac27bb3bae41c2aaf7178b5e72dbdb.jpg https://imagesdl.dealercenter.net/1024/768/202601-dcd92e75ccec4ffe914fa1a8c622be61.jpg https://imagesdl.dealercenter.net/1024/768/202601-cc9e8cc0cb664d0e9b515db3e2fc977a.jpg https://imagesdl.dealercenter.net/727/768/202601-459e8a78cc1e4802a1e72a8b906d3e35.jpg,2006 TOYOTA TUNDRA DARRELL WALTRIP EDITION 4 DOOR EXTENDED CAB PICKUPIn excellent mechanical conditionStrong  reliable V8 EngineClean title no accident reportedRuns and drives greatRegularly maintainedGood maintenance historyIt was in California until 2015 then New England areaFrame has surface rust but no rot or anything4x4 works fineGood tires  nice rimsTow hitchCons; it has a dent in the backside and missing trunk latch,CD/MP3 (Single Disc) Towing Pkg Cruise Control Power Windows Automatic Power Door Locks Dual Air Bags Steel Wheels Cassette Air Conditioning V8 4.7 Liter Power Steering 4WD Tilt Wheel ABS (4-Wheel) AM/FM Stereo,1/14/2026 4:21:22 PM
19XFB2F58CE300111,2012,Honda,Civic,LX Sedan 4D,105169,8200,Black,,Automatic  5-Spd,https://imagesdl.dealercenter.net/1024/768/202601-ccbc84cb63f44ef485a6657d764823b3.jpg https://imagesdl.dealercenter.net/1024/768/202601-4af9ad45064843a6b933e0a0c2fecedc.jpg https://imagesdl.dealercenter.net/1024/768/202601-5ee85f4ada1f40358f0e623ce511d53d.jpg https://imagesdl.dealercenter.net/1024/768/202601-79a62d8a9c264e78bf5818b3f7f1a909.jpg https://imagesdl.dealercenter.net/1024/768/202601-d313b5e4f8354582849f0bd35544512f.jpg https://imagesdl.dealercenter.net/1024/768/202601-c494663581164830a3513e32b36f0111.jpg https://imagesdl.dealercenter.net/1024/768/202601-7ed4b01860e94d4b902bb1668d2fd096.jpg https://imagesdl.dealercenter.net/1024/768/202601-d564e87828a343e4b6f9cf2b7e8ded1b.jpg https://imagesdl.dealercenter.net/1024/768/202601-80c18665e36e415da058dfac160082e9.jpg https://imagesdl.dealercenter.net/1024/768/202601-4eb31600ab104dff8956db772c06481f.jpg https://imagesdl.dealercenter.net/1024/768/202601-fda03f813f5f4eab9620f707aa1c7e69.jpg https://imagesdl.dealercenter.net/1024/768/202601-4ef404ff122b40b7bf921b879fb0478e.jpg https://imagesdl.dealercenter.net/1024/768/202601-c35da96c014a429982881a639fe317b8.jpg https://imagesdl.dealercenter.net/1024/768/202601-bc8a2bc10a0c4eab9d282cd68a3e8f76.jpg https://imagesdl.dealercenter.net/1024/768/202601-1249bf3575eb456bbf66603d083ceb9f.jpg https://imagesdl.dealercenter.net/1024/768/202601-dbca1044be72447f9c2380999228810b.jpg https://imagesdl.dealercenter.net/1024/768/202601-7e3a931643a44e51a3991e5575e89072.jpg https://imagesdl.dealercenter.net/989/768/202601-81597fc92dec4ffea651c2c6bec71d4b.jpg,Low miles Honda Civic LXClean titleIn great shape  well maintainedClean interior and exteriorIt has remote start2 keysRuns and drives great and needs nothing,Alloy Wheels F&R Head Curtain Air Bags Dual Air Bags FWD Power Steering Power Door Locks 4-Cyl VTEC 1.8 Liter Cruise Control Power Windows Tilt & Telescoping Wheel AM/FM Stereo ABS (4-Wheel) Anti-Theft System Stability Control Keyless Entry Automatic 5-Spd Air Conditioning CD/MP3 (Single Disc) Traction Control Side Air Bags Daytime Running Lights,1/15/2026 5:45:38 PM
JHMGE882X9C002708,2009,Honda,Fit,Hatchback 4D,66150,6800,Red,,Automatic  5-Spd w/Overdrive,https://imagesdl.dealercenter.net/1024/768/202601-becfb7da8e7b4165a2a50e3458b896c4.jpg https://imagesdl.dealercenter.net/1024/768/202601-92329a2d33784c82b23e29191d856d43.jpg https://imagesdl.dealercenter.net/1024/768/202601-5f6f7781347c4d2886ad8a74ac79ceb2.jpg https://imagesdl.dealercenter.net/1024/768/202601-fceeb049892944a2b8c6fc32c81c7a2c.jpg https://imagesdl.dealercenter.net/1024/768/202601-cc2be07f22a84125bb55512b7ac9e971.jpg https://imagesdl.dealercenter.net/1024/768/202601-68d01456c109432b8464da66398bbb9b.jpg https://imagesdl.dealercenter.net/1024/768/202601-046f8a172d274c3f8182b319d4181774.jpg https://imagesdl.dealercenter.net/1024/768/202601-5d74baff92d4461e927caf7b20d43602.jpg https://imagesdl.dealercenter.net/1024/768/202601-ba046a4c452f44b592ad2f8eca23a774.jpg https://imagesdl.dealercenter.net/1024/768/202601-78cad980630f43afbe67ddaf022fcc19.jpg https://imagesdl.dealercenter.net/1024/768/202601-2465deb655514dc2860497cbfba47302.jpg https://imagesdl.dealercenter.net/1024/768/202601-ae3b1d9b278b4f04810cb8ff9e4c5eb6.jpg https://imagesdl.dealercenter.net/1024/768/202601-b0cca1340f3440a09be4532a526f05ab.jpg https://imagesdl.dealercenter.net/1024/768/202601-79fb98558cc043a39d6c0259fbf3f3e2.jpg https://imagesdl.dealercenter.net/1024/768/202601-72f9c11aaa1a47d1aa041335aee2f1f6.jpg https://imagesdl.dealercenter.net/1024/768/202601-319afb1ce4154b97901ab17d40f04fdb.jpg https://imagesdl.dealercenter.net/1024/768/202601-23c359ae7f924b3780ff6dcb962641a8.jpg,Honda Fit with only 66k original milesClean title ?Runs and drives greatDoesn't need anythingBeautiful red colorClean exterior and interiorReady to goNo rust issues  clean undercarriageCome for a test drive  it's not gonna last long. Hard to find low mileage and rust free one like this. First come first serve,FWD Power Windows Air Conditioning Automatic 5-Spd w/Overdrive CD/MP3 (Single Disc) Dual Air Bags Tilt & Telescoping Wheel Power Door Locks AM/FM Stereo Power Steering Side Air Bags 4-Cyl VTEC 1.5 Liter ABS (4-Wheel),1/14/2026 4:30:46 PM
JTDZN3EU8C3111887,2012,Toyota,Prius v,Two Wagon 4D,151580,7650,Black,,Automatic  CVT,https://imagesdl.dealercenter.net/1024/768/202601-db6fb8d0370d4d8fb8978123fe0e5065.jpg https://imagesdl.dealercenter.net/1024/768/202601-fbd68a96bc8c449583291ba13c413275.jpg https://imagesdl.dealercenter.net/768/768/202601-6ba8c0e261ee4d32b2cc4c1b4e78664d.jpg https://imagesdl.dealercenter.net/1024/768/202601-0a4e20b143924cc19186ffb0a6965b5e.jpg https://imagesdl.dealercenter.net/1024/768/202601-0f42986651934e409372f9425c1b1424.jpg https://imagesdl.dealercenter.net/1024/768/202601-baaffef9e9e945aea3750c93fdbab333.jpg https://imagesdl.dealercenter.net/1024/768/202601-72415929f9b54ae0adb84a6306b23309.jpg https://imagesdl.dealercenter.net/768/768/202601-3dab79a896ef458b8712f29c429addeb.jpg https://imagesdl.dealercenter.net/768/768/202601-e8f4800f2470432bb2c79baabab5d369.jpg https://imagesdl.dealercenter.net/1024/768/202601-a994cfdff05b4e199a817a6225977829.jpg https://imagesdl.dealercenter.net/768/768/202601-77216a135eea42f78c0e3e8259b38e96.jpg https://imagesdl.dealercenter.net/1024/768/202601-4eec6c14131f4fefb96b94ccd33b3bc6.jpg https://imagesdl.dealercenter.net/1024/768/202601-bdd528c59de54e628b1223f5ae279e0b.jpg https://imagesdl.dealercenter.net/1024/768/202601-8172edb8261f4264b611e4ba0ea7714f.jpg https://imagesdl.dealercenter.net/768/768/202601-58e5f631cf664c7a9293c07cb2019703.jpg https://imagesdl.dealercenter.net/1024/768/202601-5d030201a34a4755b13b63811ab99cdb.jpg https://imagesdl.dealercenter.net/768/768/202601-81667dd8aece470d99e67f3876c7b286.jpg https://imagesdl.dealercenter.net/768/768/202601-e5f071b0ee36436184a3678459d5baa1.jpg https://imagesdl.dealercenter.net/1024/768/202601-c93c3c73cead4942ab17cb0bf822c422.jpg https://imagesdl.dealercenter.net/1024/768/202601-bef87b717bba4db48dd87d96e2b5754a.jpg,2012 Toyota Prius V Clean title ?  One owner and meticulously maintained  Great tires and Oem rims  Clean interior and exterior  Runs and drives good Strong engine  transmission and hybrid Great mpg  gas saver spacious car Usb aux connection Rear camera and navigation  Sharp looking Prius  come for a test drive today ,Rear Spoiler Traction Control Anti-Theft System Power Steering Tilt & Telescoping Wheel Backup Camera Side Air Bags AM/FM Stereo Power Seat F&R Head Curtain Air Bags Power Door Locks Automatic CVT Bluetooth Wireless Keyless Start Dual Air Bags Power Windows Stability Control Alloy Wheels ABS (4-Wheel) Hill Start Assist Control CD/MP3 (Single Disc) Cruise Control 4-Cyl Hybrid 1.8 Liter FWD Air Conditioning,1/15/2026 5:20:47 PM
2LNHM82W88X632728,2008,Lincoln,Town Car,Signature Limited Sedan 4D,134650,3900,Silver,,Automatic  4-Spd w/Overdrive,https://imagesdl.dealercenter.net/1024/768/202601-28457368da5d4d2eb4f5894284aaf1ae.jpg https://imagesdl.dealercenter.net/1024/768/202601-6f3efbfed58a45c3a7295568e2df58f5.jpg https://imagesdl.dealercenter.net/1024/768/202601-76bd85f1bb374420ad29709b70f0470d.jpg https://imagesdl.dealercenter.net/1024/768/202601-9f171f08c1684782a2cdc7c27260cde4.jpg https://imagesdl.dealercenter.net/1024/768/202601-9bb573f8f4984931bf65eee692cc5913.jpg https://imagesdl.dealercenter.net/1024/768/202601-ef791b67e11b4d45947335869adf2793.jpg https://imagesdl.dealercenter.net/1024/768/202601-2f28205561274badb39e1c0f5b6b821e.jpg https://imagesdl.dealercenter.net/1024/768/202601-65dcb3a146b04c279459ddc90aadc452.jpg https://imagesdl.dealercenter.net/1024/768/202601-2f91fefe16d84fdaaf8de648a82cf2ec.jpg https://imagesdl.dealercenter.net/1024/768/202601-6b652f8650ea413eb7650d55c3101274.jpg https://imagesdl.dealercenter.net/1024/768/202601-fcc71027b52a427d89a12b726af2e948.jpg https://imagesdl.dealercenter.net/1024/768/202601-2a6dd0889e944d5ba8bdfa74a9e735f9.jpg https://imagesdl.dealercenter.net/1024/768/202601-153ccf9fa8734443bf255abd90ef058c.jpg https://imagesdl.dealercenter.net/1024/768/202601-79aca6adc47842efbcb29b2184ab3188.jpg https://imagesdl.dealercenter.net/1024/768/202601-7e0878107b72446394a0a6ccc857113e.jpg https://imagesdl.dealercenter.net/1024/768/202601-0638e2f4b6794dc8b6b7b5ac337fa765.jpg https://imagesdl.dealercenter.net/1024/768/202601-306c4a9a4db04812aaa55cb60a1bd32b.jpg https://imagesdl.dealercenter.net/1024/768/202601-836ab966c3cf414082d1e1320aade7ad.jpg,2008 Lincoln Town Car Signature LimitedV8 strong engineClean interior and exteriorOne of the most comfortable and fun rideSpacious interior and trunkUpgraded Bluetooth connection radioOriginal radio is availableLeather seats are very comfortable and in great shapeIt has some body imperfections  it may need new battery and spark plug replacement. It is priced accordingly,Alloy Wheels Traction Control RWD CD/MP3 (Multi Disc) Power Steering Dual Power Seats Cassette Tilt Wheel Power Door Locks Air Conditioning Automatic 4-Spd w/Overdrive Power Windows Dual Air Bags Anti-Theft System Parking Sensors V8 4.6 Liter Side Air Bags AM/FM Stereo ABS (4-Wheel) Audiophile Sound Leather Cruise Control,1/14/2026 6:10:38 PM
2T1BR32E14C251159,2004,Toyota,Corolla,S Sedan 4D,147100,4100,Silver,,Automatic,https://imagesdl.dealercenter.net/1024/768/202601-47c541bbd62d4d3e854020a7792aaf32.jpg https://imagesdl.dealercenter.net/1024/768/202601-bc46ea8cdf1e49aa8c633eb62df88d8a.jpg https://imagesdl.dealercenter.net/1024/768/202601-9abde788b67843a287e05bb52b55a94b.jpg https://imagesdl.dealercenter.net/1024/768/202601-e5efdef9976a4239a8f2352ea68b4a59.jpg https://imagesdl.dealercenter.net/1024/768/202601-0d3f4f2e53994adfb726d379adb70442.jpg https://imagesdl.dealercenter.net/1024/768/202601-8cc43f0912ed4f61ba6b7d02da455247.jpg https://imagesdl.dealercenter.net/1024/768/202601-2390ffd11a4f4b978959893941d731bd.jpg https://imagesdl.dealercenter.net/1024/768/202601-14f0a71b664d4d03aca2e50f31b6d679.jpg https://imagesdl.dealercenter.net/1024/768/202601-13265d8f885a4f99b2742589dc6ec9cd.jpg https://imagesdl.dealercenter.net/1024/768/202601-2f641781ab3d4f238d75a350bff37fc9.jpg https://imagesdl.dealercenter.net/1024/768/202601-0c71d67a20834b29883a3039dc18cd23.jpg https://imagesdl.dealercenter.net/1024/768/202601-5c91f96463324ad9aa7f711244d2349e.jpg https://imagesdl.dealercenter.net/1024/768/202601-2e2d2fa730df4eda8717ce23188be518.jpg https://imagesdl.dealercenter.net/1024/768/202601-7103fdfaa50540e5ad379fa8ffb04e0e.jpg https://imagesdl.dealercenter.net/1024/768/202601-f57a36ffcb8641968e6768bb2cef5e2c.jpg https://imagesdl.dealercenter.net/1024/768/202601-72ccd1f4761a4c81aa12497aed0bf09d.jpg https://imagesdl.dealercenter.net/1024/768/202601-6089219e8e134679a612ebb6cf167eec.jpg https://imagesdl.dealercenter.net/1024/768/202601-6cc9f1138d654a4b8935d6ac8ad111ea.jpg https://imagesdl.dealercenter.net/1024/768/202601-c0dff02596bd4c4aab9010def384172f.jpg https://imagesdl.dealercenter.net/1024/768/202601-569f31e898a54e1295b95066c5d2f577.jpg https://imagesdl.dealercenter.net/1024/768/202601-4649760ed8414cf8a3652f30e90fb317.jpg https://imagesdl.dealercenter.net/1014/768/202601-d69fd9cd2bcd493e8598413e37f95b6b.jpg,2004 Toyota Corolla LeClean title ?No accident reportedDent on left front fender and scratch on right front doorRuns and drives greatNo warning lights on dashboardVery well maintainedAffordable and reliable ToyotaProfessionally detailed interior and exteriorIt has great Michelin tiresCome for a test drive,FWD Automatic Alloy Wheels AM/FM Stereo Tilt Wheel Dual Air Bags Power Door Locks Power Windows ABS (4-Wheel) 4-Cyl 1.8 Liter Air Conditioning Cruise Control Power Steering CD/MP3 (Single Disc),1/14/2026 9:15:54 PM
4T3B6RFV3NU097275,2022,Toyota,RAV4 Hybrid,XLE Premium Sport Utility 4D,136250,24000,Grey,,Automatic  ECVT,https://imagesdl.dealercenter.net/1024/768/202601-3746beb672ba4f44a30cf98786c9805d.jpg https://imagesdl.dealercenter.net/1024/768/202601-33e8fc33387d4782b56c3a495ea0fa60.jpg https://imagesdl.dealercenter.net/1024/768/202601-8c0818fd19384aa9bc89f83d6de1ea75.jpg https://imagesdl.dealercenter.net/1024/768/202601-d9f73e6c1aa245138a9834cbeb6f478e.jpg https://imagesdl.dealercenter.net/1024/768/202601-fba5a4d389c647ea8bcc9696444d8f9e.jpg https://imagesdl.dealercenter.net/1024/768/202601-d5d9a11f80104fa2b54699892ce5622d.jpg https://imagesdl.dealercenter.net/1024/768/202601-53e59d167dcb4044824419dc1517fccd.jpg https://imagesdl.dealercenter.net/1024/768/202601-ce5a599374084c379145b4801ac2a323.jpg https://imagesdl.dealercenter.net/1024/768/202601-70a23cd2ba1144608067ce9bbb7101e5.jpg https://imagesdl.dealercenter.net/1024/768/202601-adf5b4a5531943a78855fa45e678d17b.jpg https://imagesdl.dealercenter.net/1024/768/202601-93bf8593e04a4222b7eaf416f65a1918.jpg https://imagesdl.dealercenter.net/1024/768/202601-9ddfdabb0c4f42d88455e95272087165.jpg https://imagesdl.dealercenter.net/1024/768/202601-0495cccdd4e44d79917136b7dd39d95e.jpg https://imagesdl.dealercenter.net/1024/768/202601-64dfd07f559b4d8ab841e7bb31071ebd.jpg https://imagesdl.dealercenter.net/1024/768/202601-b33a8101961a47a6ae7b5dae4dd7cac2.jpg https://imagesdl.dealercenter.net/1024/768/202601-d1b545cde3854b50bafee11bf2baf388.jpg https://imagesdl.dealercenter.net/1024/768/202601-8b03694f9ab04fcbaa97196f2c7fc7dc.jpg https://imagesdl.dealercenter.net/1024/768/202601-053ab204d5ff4a948730b2a6522e1f25.jpg https://imagesdl.dealercenter.net/1024/768/202601-6280ddcf126242c3860b898a9bad326f.jpg https://imagesdl.dealercenter.net/1024/768/202601-f062592639ac493e952a7fe8b6c786fc.jpg https://imagesdl.dealercenter.net/944/768/202601-91ef618b88cc4a4781237f789641eb5f.jpg https://imagesdl.dealercenter.net/944/768/202601-513791d76d24478dbdcde8fdac24de7f.jpg,2022 TOYOTA RAV4 HYBRID XLE PREMIUMExcellent SUV with loaded trimHybrid ride gets 45+ mpgAll wheel driveVery well maintained like a brand new carClean titleAdaptive cruise  lane keep assistant  blind spot monitor  adaptive headlights  heated steering wheels and leather seatsNew tires will be installedNo online negotiationsSchedule a test drive now,Knee Air Bags Power Liftgate Release Hill Start Assist Control Power Door Locks Alloy Wheels Power Seat SiriusXM Satellite Tilt & Telescoping Wheel Lane Departure Warning System AWD Power Steering Side Air Bags Daytime Running Lights Bluetooth Wireless AM/FM Stereo Traction Control Safety Connect F&R Head Curtain Air Bags LED Headlamps Dynamic Cruise Control Backup Camera Push Button Start Roof Rails Power Windows Air Conditioning 4-Cyl Hybrid 2.5 Liter Moon Roof ABS (4-Wheel) Keyless Entry Enhanced Stability Control Fog Lights Dual Air Bags Rear Spoiler Blind-Spot Monitor Automatic ECVT,1/14/2026 6:30:33 PM
