VIN,Year,Make,Model,Trim,Odometer,SpecialPrice,ExteriorColor,InteriorColor,Transmission,PhotoURLs,WebAdDescription,EquipmentCode,LatestPhotoModifiedDate
5TDBK3EH1BS046097,2011,Toyota,Highlander,SE Sport Utility 4D,143009,8790,Black,,Auto  5-Spd w/OD & Seq Md,https://imagesdl.dealercenter.net/1024/768/202601-7f62ebd8f0cd47b88cc5df4dc4569aed.jpg https://imagesdl.dealercenter.net/1024/768/202601-17e2ef529675409e951da68a0720a81b.jpg https://imagesdl.dealercenter.net/1024/768/202601-b3a17bb72b3a44618645b10b32ed8b53.jpg https://imagesdl.dealercenter.net/1024/768/202601-4282c84ccbdc439dbc3f6af0161a4882.jpg https://imagesdl.dealercenter.net/1024/768/202601-9a585bd939874e3ca8fcad3d0b2af0b4.jpg https://imagesdl.dealercenter.net/1024/768/202601-1c62941d5b3a468faeaa863c8f97df5e.jpg https://imagesdl.dealercenter.net/1024/768/202601-9411a3b9e0f442d491a905400e19246a.jpg https://imagesdl.dealercenter.net/1024/768/202601-2a164dece8fa4b9d9ee68479f1bc71ff.jpg https://imagesdl.dealercenter.net/1024/768/202601-56a5a9404c2643c6809c5ac897ee4dfe.jpg https://imagesdl.dealercenter.net/1024/768/202601-fc241eb39c9e47e3b06e8eb091de2929.jpg https://imagesdl.dealercenter.net/1024/768/202601-0fdb4375f37948d68043dd5e6fe21b1b.jpg https://imagesdl.dealercenter.net/1024/768/202601-71ec967e4ae34d2a9a7edae41ee05cd6.jpg https://imagesdl.dealercenter.net/1024/768/202601-5e752b8277a4455aaa77317e2c98c389.jpg https://imagesdl.dealercenter.net/1024/768/202601-09feffb9d8ec465b917dac5e57dca815.jpg https://imagesdl.dealercenter.net/1024/768/202601-950389e359764b45a7801979e5f1dfa9.jpg https://imagesdl.dealercenter.net/1024/768/202601-55e00ae8baf24ede856eaa970f8f5c91.jpg https://imagesdl.dealercenter.net/1024/768/202601-791aab795b344768b844ff42329713d1.jpg https://imagesdl.dealercenter.net/1024/768/202601-d53052e21c834f138a81cf840222e04f.jpg https://imagesdl.dealercenter.net/768/768/202601-bc2f82a53eb04220967a98011fd71103.jpg https://imagesdl.dealercenter.net/1006/768/202601-315610b9ad4b4c2d8e806438cfefba59.jpg,2011 Toyota HighlanderIn excellent mechanical conditionClean titleClean carfaxNo accident reportedProfessionally detailed interior and exteriorSmall damage on front bumperReady to go143k miles,ABS (4-Wheel) Heated Seats Tilt & Telescoping Wheel Keyless Entry Auto 5-Spd w/OD & Seq Md Power Seat Traction Control Fog Lights Leather XM Satellite Side Air Bags Cruise Control Power Windows Power Steering Third Row Seat Hill Start Assist Control Towing Pkg Moon Roof CD/MP3 (Single Disc) Air Conditioning Rear Daytime Running Lights Air Conditioning Backup Camera F&R Head Curtain Air Bags AM/FM Stereo Power Door Locks Alloy Wheels V6 3.5 Liter AWD Downhill Assist Control Stability Control Dual Air Bags,1/14/2026 3:41:54 PM
2G1WG5EK6B1145377,2011,Chevrolet,Impala,LT Sedan 4D,87595,5880,White,,Automatic  4-Spd w/Overdrive,https://imagesdl.dealercenter.net/1024/768/202601-d5667ca4cf914b178c07bbc8347831d9.jpg https://imagesdl.dealercenter.net/1024/768/202601-6550f24d275546089cdb0d8edb6cc891.jpg https://imagesdl.dealercenter.net/1024/768/202601-766bb8c7d1544f13aa002ede9ceb8980.jpg https://imagesdl.dealercenter.net/1024/768/202601-251af3b798c14492ab1b66930b718775.jpg https://imagesdl.dealercenter.net/1024/768/202601-7b2d5c42eac64a519ab3a7d6c7369e6b.jpg https://imagesdl.dealercenter.net/1024/768/202601-28a96f873b48489aa4adaa751732e981.jpg https://imagesdl.dealercenter.net/1024/768/202601-06cc3ec7946b4a848cffd42f2ce6b436.jpg https://imagesdl.dealercenter.net/1024/768/202601-cfecca8cec4a4613acd7a7bd1df42b93.jpg https://imagesdl.dealercenter.net/1024/768/202601-450200c0a652484c8f9355cc5d7faa42.jpg https://imagesdl.dealercenter.net/1024/768/202601-53aad1ea91db4c11a7ad068d8f48238d.jpg https://imagesdl.dealercenter.net/1024/768/202601-1859013043234d78b46f810ebe6edb94.jpg https://imagesdl.dealercenter.net/1024/768/202601-29afab20c8f541af9cd1de3d09e59baa.jpg https://imagesdl.dealercenter.net/1024/768/202601-8ec1a02bbeec45639929144fdf12b477.jpg https://imagesdl.dealercenter.net/1024/768/202601-1ced059e9c70436c82bbb52b90ff1c61.jpg https://imagesdl.dealercenter.net/1024/768/202601-fb2dfb6e486b4afcacfaf774b46719d2.jpg https://imagesdl.dealercenter.net/1024/768/202601-c82ecc66fd434b9abec78bc877010789.jpg https://imagesdl.dealercenter.net/1024/768/202601-18ab3123fbdd48bea313609e121ab5ba.jpg https://imagesdl.dealercenter.net/1024/768/202601-60229f92a85f4a1c810c4ed2d2280fe6.jpg,2011 Chevy ImpalaOnly 87k milesClean title ?Clean interior and exteriorOn of the most comfortable high way rideNew steering pumpGood tires and Oem rimsSpacious interior and trunkFeel free to check in person or show it to your mechanic,Power Steering FWD CD/MP3 (Single Disc) ABS (4-Wheel) Keyless Start Power Door Locks Daytime Running Lights Fog Lights OnStar Power Seat Stability Control F&R Head Curtain Air Bags XM Satellite Air Conditioning Cruise Control Keyless Entry Power Windows AM/FM Stereo Traction Control Side Air Bags Alloy Wheels Tilt Wheel V6 Flex Fuel 3.5 Liter Dual Air Bags Automatic 4-Spd w/Overdrive,1/14/2026 4:09:55 PM
2T3BF4DVXAW027580,2010,Toyota,RAV4,Sport Utility 4D,139750,7490,Gold,,Automatic  4-Spd w/Overdrive,https://imagesdl.dealercenter.net/1024/768/202601-6a12f1c0723a42faa1d21fbfef2e01bc.jpg https://imagesdl.dealercenter.net/1024/768/202601-b7b1b50f1cc847d39d18e470f3588052.jpg https://imagesdl.dealercenter.net/768/768/202601-d462a1b7b4ea454bbd239dad5a1f5c12.jpg https://imagesdl.dealercenter.net/1024/768/202601-217990dc2039455fb5f77c28d1cb37ca.jpg https://imagesdl.dealercenter.net/1024/768/202601-74dda71fbe24412bba7e8e36b958e95a.jpg https://imagesdl.dealercenter.net/768/768/202601-7bf464b2f7d8446ba6cf7bc10d056f48.jpg https://imagesdl.dealercenter.net/1024/768/202601-984bbba1151542e9b9b174d390ffbfbb.jpg https://imagesdl.dealercenter.net/1024/768/202601-5f7ad091aa9c4fa2b77fcc70de2f4fac.jpg https://imagesdl.dealercenter.net/1024/768/202601-e8706dca1b53455d879a97c60eb01bb0.jpg https://imagesdl.dealercenter.net/1024/768/202601-065b7c2a6a8948e4b00e8d6beac2166d.jpg https://imagesdl.dealercenter.net/1024/768/202601-3f84e89fcd2b4850a6a20dd99e9015c7.jpg https://imagesdl.dealercenter.net/1024/768/202601-17d12e3c10034c55975db87ebcfa9b01.jpg https://imagesdl.dealercenter.net/768/768/202601-48fc32ee28c04310aec5c9a5a396fdbf.jpg https://imagesdl.dealercenter.net/768/768/202601-911e9593a369449892fdc358e0a09bbf.jpg https://imagesdl.dealercenter.net/1024/768/202601-73991641117c46529fb8b053770e60b2.jpg https://imagesdl.dealercenter.net/768/768/202601-16335101b33d4f148f7f0a3ad80bfcab.jpg https://imagesdl.dealercenter.net/1024/768/202601-382428b1f7004cb4b154bfaa0fe06371.jpg https://imagesdl.dealercenter.net/1024/768/202601-e91b679f38d1423ba6a8a69e7cda15d5.jpg https://imagesdl.dealercenter.net/1022/768/202601-6e854a4cde9d49619f64c5e440dea558.jpg,2010 Rav4 with 139k milesClean title and clean carfax ?Runs and drives greatNeeds nothing  ready to goClean interior and exteriorVery well maintainedGood tiresSpacious trunk4wd for good performance in winter conditionsFeel free to check in person or show it to your mechanic,Keyless Entry Power Steering Steel Wheels Power Door Locks Anti-Theft System AM/FM Stereo F&R Head Curtain Air Bags 4WD Stability Control Rear Spoiler Traction Control Dual Air Bags Air Conditioning 4-Cyl 2.5 Liter Satellite Feature CD/MP3 (Single Disc) ABS (4-Wheel) Power Windows Automatic 4-Spd w/Overdrive Tilt & Telescoping Wheel Cruise Control Side Air Bags,1/14/2026 8:00:49 PM
JTDZN3EU6C3066609,2012,Toyota,Prius v,Two Wagon 4D,136650,8700,Black,,Automatic  CVT,https://imagesdl.dealercenter.net/1024/768/202601-8be387c7378d4ce4baea16a624419448.jpg https://imagesdl.dealercenter.net/1024/768/202601-7df348a96be6498a9cf7cc4d3f8ff4f3.jpg https://imagesdl.dealercenter.net/1024/768/202601-727a222dbf484e24b0aa7146f69876cb.jpg https://imagesdl.dealercenter.net/1024/768/202601-3c2206a3c79f462fa2992e4fc00c5a26.jpg https://imagesdl.dealercenter.net/1024/768/202601-58fe96851ca84268a408fbaa617d6cc9.jpg https://imagesdl.dealercenter.net/1024/768/202601-209b6ce539164bdc8c975d79d6042d9e.jpg https://imagesdl.dealercenter.net/1024/768/202601-a5e8db53b4a94ae088037fac14c6faca.jpg https://imagesdl.dealercenter.net/1024/768/202601-91c99fb55fb946cd8e4eeb994c417fbc.jpg https://imagesdl.dealercenter.net/1024/768/202601-7d9159d7222b4eb08ee540c23184b27b.jpg https://imagesdl.dealercenter.net/1024/768/202601-41d145d88e654424a818d03005ce2a2c.jpg https://imagesdl.dealercenter.net/1024/768/202601-8512eb0711fe49fc9f4588b71e7510f1.jpg https://imagesdl.dealercenter.net/1024/768/202601-19a1bce8934a4a87aee80bc24991c772.jpg https://imagesdl.dealercenter.net/1024/768/202601-38c1d4bd2cce4400be1d5d32a7482663.jpg https://imagesdl.dealercenter.net/1024/768/202601-126f6df8c8674978b0817736a9b9baf5.jpg https://imagesdl.dealercenter.net/1007/768/202601-c456fa069fe14cfaa5326de8461188c9.jpg https://imagesdl.dealercenter.net/1024/768/202601-e0fcc148e178479280b525aa1a1a5d12.jpg https://imagesdl.dealercenter.net/1024/768/202601-8bdde78e0341472fb7b90b0b4358dc45.jpg https://imagesdl.dealercenter.net/1024/768/202601-c5c1d8c51ace4caf80c1dd6ec6ff1b44.jpg https://imagesdl.dealercenter.net/1024/768/202601-432011e766b94928a5beca244f12519c.jpg,2012 Toyota Prius VClean title ?One owner and meticulously maintainedGreat tires and Oem rimsClean interior and exteriorRuns and drives goodStrong engine  transmission and hybridGreat mpg  gas saver spacious carUsb aux connectionRear camera and navigationSharp looking Prius  come for a test drive today,4-Cyl Hybrid 1.8 Liter Hill Start Assist Control Backup Camera Keyless Start FWD AM/FM Stereo Tilt & Telescoping Wheel Air Conditioning Bluetooth Wireless Anti-Theft System Automatic CVT Power Seat Cruise Control Alloy Wheels CD/MP3 (Single Disc) ABS (4-Wheel) Power Windows Rear Spoiler Side Air Bags Dual Air Bags Traction Control F&R Head Curtain Air Bags Power Steering Stability Control Power Door Locks,1/14/2026 9:10:57 PM
WDDSJ4GB9GN389938,2016,Mercedes-Benz,CLA,CLA 250 4MATIC Coupe 4D,85650,12750,Grey,,Auto  7-Spd Dbl Clutch,https://imagesdl.dealercenter.net/1024/768/202601-e095ce2c1a4c4313951feded5c55cc66.jpg https://imagesdl.dealercenter.net/1024/768/202601-deadd8f2101447f2a70371adea2e7503.jpg https://imagesdl.dealercenter.net/1024/768/202601-1e724008598c4553909ef5b8855a4274.jpg https://imagesdl.dealercenter.net/1024/768/202601-530737b9e84f476aa09b0b11613603c4.jpg https://imagesdl.dealercenter.net/1024/768/202601-a1bc50285ba740c7889ebcdd8abb48ee.jpg https://imagesdl.dealercenter.net/1024/768/202601-887cac5044a54eb38380dcb23929addd.jpg https://imagesdl.dealercenter.net/1024/768/202601-c0ea694ef1a84afbaf5ccd12825ccde4.jpg https://imagesdl.dealercenter.net/1024/768/202601-9a48cecc448748389083792fb6cd809f.jpg https://imagesdl.dealercenter.net/1024/768/202601-f6714bb8c8cd48a9a89aae161f7955b0.jpg https://imagesdl.dealercenter.net/1024/768/202601-aa2450b230cf4d6aac36bd94a5d9ef54.jpg https://imagesdl.dealercenter.net/768/768/202601-98a8e048dd5f40a790bb94095688089a.jpg https://imagesdl.dealercenter.net/1024/768/202601-432a9897ba1341239ec6639ccab2bf77.jpg https://imagesdl.dealercenter.net/1024/768/202601-05781238fdb24c41b8321d9164f62f46.jpg https://imagesdl.dealercenter.net/1024/768/202601-f0a86e7280544026bf82dcdb42f3eddd.jpg https://imagesdl.dealercenter.net/768/768/202601-29441969432e45cd8a79084e4de1945e.jpg https://imagesdl.dealercenter.net/768/768/202601-6f3dfc6597be45bcba7b5f73f80b0c6b.jpg https://imagesdl.dealercenter.net/768/768/202601-16af672d5ce640a594f5ba2796f6f9f5.jpg https://imagesdl.dealercenter.net/768/768/202601-963fc6a429fb4518bfc0d441c2b04e4f.jpg https://imagesdl.dealercenter.net/768/768/202601-54279a99f33343f492955fe2832e924b.jpg https://imagesdl.dealercenter.net/995/768/202601-447fc88cfb0d4bed9ab8cb351df15e58.jpg,Beautiful 2016 Mercedes Benz CLA 2504dr 4MATIC85k milesRuns and drives amazingClean titleWell maintainedProfessionally detailedNo issuesReady to go,Power Steering Daytime Running Lights Power Door Locks Dual Air Bags Auto 7-Spd Dbl Clutch Dual Power Seats AWD Knee Air Bags Hill Start Assist Control Alloy Wheels Stability Control Side Air Bags AM/FM/HD Radio Power Windows Alarm System 4-Cyl Turbo 2.0 Liter Bluetooth Wireless Keyless Entry Air Conditioning Traction Control CD/MP3 (Single Disc) mbrace2 Tilt & Telescoping Wheel ABS (4-Wheel) F&R Head Curtain Air Bags,1/15/2026 5:25:38 PM
JTEDW21AX60007321,2006,Toyota,Highlander,Hybrid Sport Utility 4D,171300,5491,Silver,,Automatic  CVT,https://imagesdl.dealercenter.net/1024/768/202601-950f626bbf9d4f98950818bb59236a08.jpg https://imagesdl.dealercenter.net/768/768/202601-889043ebbbee40c5a020ac0bb67d1422.jpg https://imagesdl.dealercenter.net/1024/768/202601-0ed56fb597154b8490d9ce525b743a35.jpg https://imagesdl.dealercenter.net/1024/768/202601-bbfa3fdcb8334059bd7b8db17f85cc01.jpg https://imagesdl.dealercenter.net/768/768/202601-2987e713c93f4037b6c4091691f216d1.jpg https://imagesdl.dealercenter.net/1024/768/202601-a19a3568e2ad4f46826d6da9438b53d0.jpg https://imagesdl.dealercenter.net/1024/768/202601-860a0f5e5e1b45e4b33c7caec109fe6d.jpg https://imagesdl.dealercenter.net/768/768/202601-77f29a2fd9c540eeb271fb206af8820f.jpg https://imagesdl.dealercenter.net/1024/768/202601-15c6023c0d1f4a6080ffa1b927e30fac.jpg https://imagesdl.dealercenter.net/1024/768/202601-55774243b7c54169816c6269639a7086.jpg https://imagesdl.dealercenter.net/768/768/202601-e3368111e92145d58572a520a0b118d4.jpg https://imagesdl.dealercenter.net/1024/768/202601-cc90819759c44143b370866e273c6a9a.jpg https://imagesdl.dealercenter.net/1024/768/202601-59911b2c6a1841db8db1147228c820e0.jpg https://imagesdl.dealercenter.net/1024/768/202601-b7ff09c040f044749aaf390ebaaecb45.jpg https://imagesdl.dealercenter.net/1024/768/202601-e630a9979fc44ccebba6349a4854bbb0.jpg https://imagesdl.dealercenter.net/768/768/202601-3e26028186104e049c1049d170a9f267.jpg https://imagesdl.dealercenter.net/768/768/202601-942b8c1121ad48b3921592a27394167b.jpg https://imagesdl.dealercenter.net/1024/768/202601-feed45b9e7394e0daa0a00148e292507.jpg https://imagesdl.dealercenter.net/768/768/202601-7b47857bc8c6485c8e27490b56ed26ff.jpg,2006 Toyota Highlander HybridClean title ?Runs and drives goodGood tires and rimsHybrid ride gets better gas mileageElectronic heated leather seatsSunroof  tow hitchThird row 7 seaterNo warning lightsReady to go,Power Seat Traction Control ABS (4-Wheel) Stability Control Alloy Wheels Power Windows Power Steering CD/MP3 (Single Disc) Cruise Control Tilt Wheel Power Door Locks 2WD Cassette AM/FM Stereo Dual Air Bags Third Row Seat Air Conditioning Automatic CVT F&R Side Air Bags V6 Hybrid 3.3 Liter Roof Rack,1/14/2026 5:10:42 PM
JTDBL40E099057052,2009,Toyota,Corolla,S Sedan 4D,97900,7250,Green,,Automatic  4-Spd w/Overdrive,https://imagesdl.dealercenter.net/1024/768/202601-3d2133c0c26341758384f007196e9a05.jpg https://imagesdl.dealercenter.net/1024/768/202601-094d17a423c744788b2fe52f8fdee4aa.jpg https://imagesdl.dealercenter.net/1024/768/202601-4dedf88adb1446668c9a2eadd7eba6d9.jpg https://imagesdl.dealercenter.net/1024/768/202601-630ad5a659c04f65a2886c1d7036b74a.jpg https://imagesdl.dealercenter.net/1024/768/202601-e14f684c51114ae5acb46abd1111e29a.jpg https://imagesdl.dealercenter.net/1024/768/202601-dc0846c3a1f641cdb64649d41026cbda.jpg https://imagesdl.dealercenter.net/1024/768/202601-c35d810e622c49e9bcb97359536fac7e.jpg https://imagesdl.dealercenter.net/1024/768/202601-03cb4923594d43e69e0f8d6e2d7ebb29.jpg https://imagesdl.dealercenter.net/1024/768/202601-132869c6f18f41f6b2cebaac423b9d05.jpg https://imagesdl.dealercenter.net/1024/768/202601-51c2adca00a54c0bba9a24c095fa0361.jpg https://imagesdl.dealercenter.net/1024/768/202601-0a119eead651428697d4c9dcb664bdbf.jpg https://imagesdl.dealercenter.net/1024/768/202601-d9cea5d7a2924634996df3be4cb84b7f.jpg https://imagesdl.dealercenter.net/1024/768/202601-2b9fe5c92da04854bc876687c74bc195.jpg https://imagesdl.dealercenter.net/1024/768/202601-c4bdf3a6f7654f489846b7979c247ae0.jpg https://imagesdl.dealercenter.net/1024/768/202601-f89967ef958442e599c2551830001ec9.jpg https://imagesdl.dealercenter.net/1024/768/202601-ada8c3168cf540ec9911b70f4b3e5174.jpg https://imagesdl.dealercenter.net/1024/768/202601-4169e896f8c8454aa93bdeb4ee9a6bfe.jpg https://imagesdl.dealercenter.net/1024/768/202601-0c82593f7c00486f9fbc4ef78e780361.jpg,2009 Toyota Corolla LEOnly 97k milesClean title no accident reportedThere are couple scratches on the sides but nothing bad  good paint clean interior and exterior.Runs and drives great.Strong engine and transmissionReady to goSchedule a test drive now,ABS (4-Wheel) CD/MP3 (Multi Disc) Rear Spoiler Keyless Entry Anti-Theft System AM/FM Stereo Tilt Wheel Alloy Wheels Automatic 4-Spd w/Overdrive Power Steering Power Windows Daytime Running Lights Side Air Bags Cruise Control Traction Control Head Curtain Air Bags FWD Stability Control Air Conditioning Fog Lights Dual Air Bags 4-Cyl 1.8 Liter,1/15/2026 5:15:45 PM
JTEDP21A340003329,2004,Toyota,Highlander,Sport Utility 4D,141920,5099,Brown,,Automatic,https://imagesdl.dealercenter.net/1024/768/202601-01980219500d486183cbecb727c4fefc.jpg https://imagesdl.dealercenter.net/1024/768/202601-d2eb7e2d39154760ae526dce504d2bce.jpg https://imagesdl.dealercenter.net/1024/768/202601-d4a3210d951a498f8d71dddba2bab95b.jpg https://imagesdl.dealercenter.net/1024/768/202601-74e97b05fe734f859b8d3b089e6c918c.jpg https://imagesdl.dealercenter.net/1024/768/202601-d8d0600e5451422cab83480fd45663ae.jpg https://imagesdl.dealercenter.net/1024/768/202601-dbe3a27d54024b35983f632eda69bd58.jpg https://imagesdl.dealercenter.net/768/768/202601-e1727e5413a64c32803914131d6a1597.jpg https://imagesdl.dealercenter.net/1024/768/202601-9188c25d88ae496984fa6b32a5a9df72.jpg https://imagesdl.dealercenter.net/1024/768/202601-6d094597898d4142bb3acdca373bf9f1.jpg https://imagesdl.dealercenter.net/768/768/202601-25b0f8d797994b6280b27a0980139ea6.jpg https://imagesdl.dealercenter.net/1024/768/202601-e3509037eb50421fbe5fe6322308f4c1.jpg https://imagesdl.dealercenter.net/1024/768/202601-d0a41d7b1092466eb5eaea43c276e798.jpg https://imagesdl.dealercenter.net/1024/768/202601-c31799ac310b45e8b52e64cd122920db.jpg https://imagesdl.dealercenter.net/1024/768/202601-2033df9766a943648921bf61afb78235.jpg https://imagesdl.dealercenter.net/768/768/202601-238845e68e614ca9b76b9ab8d7585098.jpg https://imagesdl.dealercenter.net/768/768/202601-87543fd85f534286aef3f7976b386c51.jpg https://imagesdl.dealercenter.net/768/768/202601-d2b59842db384c42b73511955d5ec1b6.jpg https://imagesdl.dealercenter.net/1014/768/202601-84813a71b41b4694b890533aa5a46ee3.jpg,Toyota Highlander with low milesClean title141k milesStrong engine and transmissionClean interior and exteriorGood looking rims and good tiresThird row 7 seaterSunroof  electronic seats  cassette and cd playerReliable and affordable Toyota SUV in decent conditionReady for next ownerSchedule a test drive now,ABS (4-Wheel) Power Door Locks 2WD Steel Wheels Air Conditioning Cassette AM/FM Stereo V6 3.3 Liter Cruise Control Automatic Power Steering Power Windows Dual Air Bags Third Row Seat Tilt Wheel CD/MP3 (Single Disc),1/14/2026 10:40:34 PM
5FRYD4H29FB016825,2015,Acura,MDX,SH-AWD Sport Utility 4D,153600,9990,White,,Auto  6-Spd SptShft,https://imagesdl.dealercenter.net/1024/768/202601-afbebc0660ce47b98327937051bc1fdf.jpg https://imagesdl.dealercenter.net/1024/768/202601-5cc819304c4d467090a1fbd9cd7e1bdc.jpg https://imagesdl.dealercenter.net/1024/768/202601-09658ca7256a434981ed653d8264e5a3.jpg https://imagesdl.dealercenter.net/1024/768/202601-cca81d469b194816a9680e01660197f9.jpg https://imagesdl.dealercenter.net/1024/768/202601-4236552a82984f129eeac394c047ad4b.jpg https://imagesdl.dealercenter.net/1024/768/202601-8eca8b71674e44c79fce460421c185e7.jpg https://imagesdl.dealercenter.net/1024/768/202601-60ea79798a4c4de3b6e50d6005cceea1.jpg https://imagesdl.dealercenter.net/1024/768/202601-2d46d67e58954c688daf8b9a3f40dd58.jpg https://imagesdl.dealercenter.net/1024/768/202601-9e416a5505354e0ca7267dbd3dd7f977.jpg https://imagesdl.dealercenter.net/1024/768/202601-3e2ec05b28fc4679b272d09a4fd14042.jpg https://imagesdl.dealercenter.net/727/768/202601-59455d1cfb224d9cbc6fbc74a587706e.jpg https://imagesdl.dealercenter.net/1024/768/202601-b3d562940d444f77a9cd4f6ae2dd64bc.jpg https://imagesdl.dealercenter.net/1024/768/202601-131d3a46065341dcbf272ff390c83162.jpg https://imagesdl.dealercenter.net/1024/768/202601-dad6e3bd733b445c8e3eb7ed4259ca2b.jpg https://imagesdl.dealercenter.net/1024/768/202601-8d7cd5eeabb04e509a3f912887e9ac47.jpg https://imagesdl.dealercenter.net/1024/768/202601-52ff0225f94e4bdca790735e7ca66ca0.jpg https://imagesdl.dealercenter.net/1024/768/202601-0f8d81b2f40143c8ae2bd297c65307ee.jpg https://imagesdl.dealercenter.net/1024/768/202601-6082989e4f52419d90eb87889f064b24.jpg https://imagesdl.dealercenter.net/1024/768/202601-6f46b0c579534de8afca8e319213be22.jpg https://imagesdl.dealercenter.net/1024/768/202601-8b69eeeebf53480eb754f922f67a50d5.jpg,2015 Acura MdxLuxury 3rd row SUV 7 seaterClean title ?Runs and drives goodIt has almost brand new tires onGood maintenance historyFresh trade in for a brand new AcuraClean interior and exteriorHeated electronic seats are in great condition.Sunroof  navigation  rear camera  spacious trunk  separate rear climate controlFresh oil change is done ??Feel free to check in person or show it to your mechanic,ABS (4-Wheel) Tilt Wheel Side Air Bags Air Conditioning CD/MP3 (Single Disc) Rear Spoiler SiriusXM Satellite Blind-Spot Alert AM/FM Stereo Moon Roof Heated Seats Power Steering Cruise Control Auto 6-Spd SptShft LED Headlamps Navigation System Dual Power Seats Leather Technology Pkg Third Row Seat Keyless Entry Air Conditioning Rear Knee Air Bags Bluetooth Wireless Keyless Start Stability Control Traction Control F&R Head Curtain Air Bags Power Windows Power Liftgate Release V6 i-VTEC 3.5 Liter Dual Air Bags Premium Sound Power Door Locks Alarm System Multi-View R/V Camera AWD Daytime Running Lights Hill Start Assist Alloy Wheels,1/14/2026 5:10:43 PM
5J8TB4H59DL021482,2013,Acura,RDX,Sport Utility 4D,111433,11900,Black,,Auto  6-Spd w/Sptshft,https://imagesdl.dealercenter.net/1024/768/202601-9542769e049243ed883aa177bc5b9402.jpg https://imagesdl.dealercenter.net/1024/768/202601-59dec021e76e45c09806709ce6390759.jpg https://imagesdl.dealercenter.net/1024/768/202601-c0e699798d1e4cfa862d1f8e20191d98.jpg https://imagesdl.dealercenter.net/1024/768/202601-e076571e3b6a4ae397718099e0252068.jpg https://imagesdl.dealercenter.net/1024/768/202601-eb0dfa2781914f3fa808c75ef95edd05.jpg https://imagesdl.dealercenter.net/1024/768/202601-5cca5705e4964b109274bee8b5cce6cd.jpg https://imagesdl.dealercenter.net/1024/768/202601-e90adaf7b37545cda027137773a3f35d.jpg https://imagesdl.dealercenter.net/1024/768/202601-8ad3b835a79243679895ebee61fc70cc.jpg https://imagesdl.dealercenter.net/1024/768/202601-0ba917242dc14181b58a63f8413bda41.jpg https://imagesdl.dealercenter.net/1024/768/202601-6a760edda6404fdc900fd02031c3d554.jpg https://imagesdl.dealercenter.net/1024/768/202601-720bf50073664b3c8519bf750b9eb785.jpg https://imagesdl.dealercenter.net/1024/768/202601-11eecac240c34eada54f493c57f07331.jpg https://imagesdl.dealercenter.net/1024/768/202601-d19b2d34211146cebbabe5669e910ea4.jpg https://imagesdl.dealercenter.net/1024/768/202601-15072999bbc24f61a53b721e74f66c20.jpg https://imagesdl.dealercenter.net/1024/768/202601-0a3cd109f11b4cea96f3dcd55ba928fa.jpg https://imagesdl.dealercenter.net/1024/768/202601-df426777e45f4d0f931014391be3f77d.jpg https://imagesdl.dealercenter.net/1024/768/202601-b6464ef073244418a1fbd326d406fbd9.jpg https://imagesdl.dealercenter.net/1024/768/202601-18b4242a13434a2cafad4bde1cc5a6de.jpg https://imagesdl.dealercenter.net/1014/768/202601-a9a9e2188eaa4c6faae4bceb1ff84b9d.jpg,Acura Rdx in excellent shapeAll wheel drive  safer rides in winterClean title ?Black on blackClean  nice looking exterior and interiorElectronic  heated  leather seatsMeticulously maintained one owner SUVOne small fender bender from 2016It has sunroof  dual climate control back up cam  2 keys  push start good tires and oem rimsNo lights on the dashboardReady to go,Backup Camera Power Seat ABS (4-Wheel) Power Windows F&R Head Curtain Air Bags Traction Control Hill Start Assist Control Tilt & Telescoping Wheel AWD Power Steering Rear Spoiler HID Headlamps Heated Seats Auto 6-Spd w/Sptshft Dual Air Bags Cruise Control AM/FM Stereo CD/MP3 (Single Disc) Anti-Theft System Moon Roof Air Conditioning V6 3.5 Liter Side Air Bags Technology Pkg XM Satellite Stability Control Alloy Wheels Dolby ProLogic Sound Power Door Locks Leather Keyless Entry Daytime Running Lights Keyless Start Navigation System Power Liftgate Release Bluetooth Wireless,1/14/2026 4:11:42 PM
