VIN,Year,Make,Model,Trim,Odometer,SpecialPrice,ExteriorColor,InteriorColor,Transmission,PhotoURLs,WebAdDescription,EquipmentCode,LatestPhotoModifiedDate
JF1GE6B61BG513438,2011,Subaru,Impreza,2.5i Premium Sedan 4D,133450,5200,Blue,,Manual  5-Spd w/Overdrive,https://imagesdl.dealercenter.net/1024/768/202601-6e5aa05f84f54c35972513f8a9139fdd.jpg https://imagesdl.dealercenter.net/1024/768/202601-eef7b684502b4531b299c9f75a41ea6b.jpg https://imagesdl.dealercenter.net/1024/768/202601-8e3836621c1140abb2e7f3fd9b1c2002.jpg https://imagesdl.dealercenter.net/1024/768/202601-b743f7ade974484aa5b0413c12fcd8db.jpg https://imagesdl.dealercenter.net/1024/768/202601-51732e7bf6d44a71839203ad31bf44ce.jpg https://imagesdl.dealercenter.net/1024/768/202601-5db3fa95806649698da7929fdfda4d58.jpg https://imagesdl.dealercenter.net/1024/768/202601-ca3dff266ef446e1a2f1dcab3120c3d5.jpg https://imagesdl.dealercenter.net/1024/768/202601-cdad7d58a86a4115b3930fd5be7047ad.jpg https://imagesdl.dealercenter.net/1024/768/202601-2c88bd81fb824d82aaba0e24d8b47f5c.jpg https://imagesdl.dealercenter.net/1024/768/202601-09c96d16360a465ab4fa4592f900d2ff.jpg https://imagesdl.dealercenter.net/1024/768/202601-c38093e366c94f588a80f04f014ae72c.jpg https://imagesdl.dealercenter.net/1024/768/202601-b1c833f4726d4185ad2f985d0cf60399.jpg https://imagesdl.dealercenter.net/1024/768/202601-0abe8eeccdd14d1e862c5d7bfb7aea9b.jpg https://imagesdl.dealercenter.net/1024/768/202601-83c2a3f480b64cd4b52167f07085285d.jpg https://imagesdl.dealercenter.net/1024/768/202601-eae68ffdfc46411eb19db57e3dcfd01c.jpg https://imagesdl.dealercenter.net/1024/768/202601-f7cb7e43438844b4b4cd49c7b001153e.jpg https://imagesdl.dealercenter.net/1024/768/202601-739a43e16f9e42ccac0075b519518186.jpg https://imagesdl.dealercenter.net/1024/768/202601-02efe144593c41c0ada4c1910c6478ad.jpg https://imagesdl.dealercenter.net/930/768/202601-8c5b73a8a75f427ca3d2b8fcf362f1bd.jpg,2011 Subaru Impreza AWDClean titleNo accident reportedClean interior and exteriorGreat maintenance recordBrand new ac compressor  steering pump and suspension partsAWD gives better and safer performance in winter conditionsStick shift manual transmissionReady to goYou can schedule a test drive now.,Side Air Bags AWD Cruise Control Keyless Entry Alloy Wheels AM/FM Stereo Traction Control Bluetooth Wireless CD/MP3 (Multi Disc) Air Conditioning Vehicle Dynamic Control Anti-Theft System ABS (4-Wheel) Satellite Feature Manual 5-Spd w/Overdrive Power Windows Dual Air Bags Hill Start Assist Moon Roof F&R Head Curtain Air Bags Daytime Running Lights Power Door Locks Tilt Wheel Power Steering 4-Cyl 2.5 Liter,1/15/2026 5:40:52 PM
JTMDFREV5FD174401,2015,Toyota,RAV4,Limited Sport Utility 4D,175550,10850,Red,,Automatic  6-Spd,https://imagesdl.dealercenter.net/1024/768/202601-535cff2dc69241dd94bdfb9bc68d1d85.jpg https://imagesdl.dealercenter.net/1024/768/202601-6daebefaa85941d4b2e310dd4370eb85.jpg https://imagesdl.dealercenter.net/1024/768/202601-f1f43a2a351d484eb1da5a7d5cdce85f.jpg https://imagesdl.dealercenter.net/1024/768/202601-ef7cc3c3dddc45e6ab8296fae41cf026.jpg https://imagesdl.dealercenter.net/1024/768/202601-39e1fc0081cb4a99bddaca4c8b7660f2.jpg https://imagesdl.dealercenter.net/1024/768/202601-dbc15437b4ae43d8ba7da490fbffd556.jpg https://imagesdl.dealercenter.net/1024/768/202601-803fb748023e4b97bc2a1d5015340dc9.jpg https://imagesdl.dealercenter.net/1024/768/202601-d7ebc0a6c5814c3cbcd08f66bc908310.jpg https://imagesdl.dealercenter.net/1024/768/202601-8a47e151a3d94b7899841024bb085445.jpg https://imagesdl.dealercenter.net/1024/768/202601-1d4518e36eb14b9ca9af0a40353c633c.jpg https://imagesdl.dealercenter.net/1024/768/202601-d0bfeecd3bce4fd6814478495cd8ba37.jpg https://imagesdl.dealercenter.net/1024/768/202601-a4219d9a9a0d48ccbaf9625c98612acf.jpg https://imagesdl.dealercenter.net/1024/768/202601-4a6de90970584e60955d3b4d5a28491c.jpg https://imagesdl.dealercenter.net/1024/768/202601-0d61c0ab6bbb4a03a66d1fbb30485eed.jpg https://imagesdl.dealercenter.net/1024/768/202601-292d919c071447b68e63a67161daeb11.jpg https://imagesdl.dealercenter.net/1024/768/202601-61104a7c4b7f4d8fa586d0178f93ff86.jpg https://imagesdl.dealercenter.net/1024/768/202601-9301643eeee449e9ac342180cfbba3ac.jpg https://imagesdl.dealercenter.net/1024/768/202601-59f85dea448546ba953c2966ffad2777.jpg https://imagesdl.dealercenter.net/1024/768/202601-ceb1ccdaf7bd413ea08cb8f08f6e8c31.jpg https://imagesdl.dealercenter.net/1014/768/202601-f5ec0637051445d2b71ad55dd8dff619.jpg,2015 Toyota RAV4 Limited AWDIn excellent condition1 Owner  Clean titleExceptional maintenance recordRuns and drives greatBlind spot monitoring and lane keep assistBack up cameraGood tires Oem rimsMoonroofHeated leather seatsEco and sport modesClean interior and exteriorNeeds nothing  ready to go,Air Conditioning CD/MP3 (Single Disc) Entune Premium Audio Power Steering Keyless Start Traction Control Power Liftgate Release AM/FM Stereo Alloy Wheels Cruise Control Fog Lights Rear Spoiler Entune Power Seat Daytime Running Lights Enhanced Stability Control SiriusXM Satellite Heated Seats F&R Head Curtain Air Bags Bluetooth Wireless Power Door Locks Backup Camera Moon Roof Tilt & Telescoping Wheel Automatic 6-Spd Power Windows Navigation System Dual Air Bags Anti-Theft System Side Air Bags ABS (4-Wheel) 4-Cyl 2.5 Liter Keyless Entry Knee Air Bags AWD,1/15/2026 5:20:51 PM
JTJHW31U360046402,2006,Lexus,RX,RX 400h Sport Utility 4D,157100,5650,Blue,,Automatic  CVT,https://imagesdl.dealercenter.net/1024/768/202601-2d27fce93027448bac9ef2b99bf2d643.jpg https://imagesdl.dealercenter.net/1024/768/202601-8d5101fae9a44d4785b8ae696c2b3753.jpg https://imagesdl.dealercenter.net/1024/768/202601-f0546ce6d16946f5b14a924cbb6dffdf.jpg https://imagesdl.dealercenter.net/1024/768/202601-ce2d115bef79421c9d8f6de79a2b0282.jpg https://imagesdl.dealercenter.net/1024/768/202601-e3b7c7d397634d1296027fa6fcf016ec.jpg https://imagesdl.dealercenter.net/1024/768/202601-6d50e5739f9e4ba283958d58160b2e7e.jpg https://imagesdl.dealercenter.net/1024/768/202601-7dedfb14677045d780ca38750bca2f00.jpg https://imagesdl.dealercenter.net/1024/768/202601-a6f9bab550284abdb735a0c43a5eb021.jpg https://imagesdl.dealercenter.net/1024/768/202601-29c86ad206bc4d50927fa1ca700e4c69.jpg https://imagesdl.dealercenter.net/1024/768/202601-2686b64390f54ae98fb558d417b3eb03.jpg https://imagesdl.dealercenter.net/1024/768/202601-dfcbee079519435788ecbbd8ee69dfd1.jpg https://imagesdl.dealercenter.net/1024/768/202601-90abef6d0f584ae686a793a752e1d29c.jpg https://imagesdl.dealercenter.net/1024/768/202601-8d3468cfb832411482b389a3e01bb2cf.jpg https://imagesdl.dealercenter.net/1024/768/202601-dfbc273b798b4390b799221fc2fa080a.jpg https://imagesdl.dealercenter.net/1024/768/202601-f98b24dde6354846864990c549292947.jpg https://imagesdl.dealercenter.net/1024/768/202601-4a1cab0bb6564ad285e2a9a1c90e8abb.jpg,Lexus Rx400hHybrid SUV with all wheel driveExcellent quality materialsClean title ? Clean carfaxNo accident reportedGreat looking interior and exteriorRuns and drives goodHybrid ride for saving gasStrong v6 engine and smooth transmissionHeated leather seats  sunroof  Oem alloy wheels  dual climate  cd and cassette player. This is one of the most reliable SUV modelFeel free to check in person or show it to your mechanic.,Power Door Locks AWD Cruise Control Traction Control Backup Camera Stability Control V6 Hybrid 3.3 Liter Dual Power Seats ABS (4-Wheel) Power Steering Power Windows CD/MP3 (Multi Disc) Alloy Wheels Dual Air Bags Side Air Bags Moon Roof Mark Levinson Sound Tilt Wheel Leather AM/FM Stereo Navigation System Air Conditioning Automatic CVT,1/14/2026 5:15:43 PM
JTHKD5BH0B2033552,2011,Lexus,CT,CT 200h Hatchback 4D,179260,7200,Yellow,,Automatic  CVT,https://imagesdl.dealercenter.net/1024/768/202601-cd9c8e42c4044967947a8e4dbb15abb4.jpg https://imagesdl.dealercenter.net/1024/768/202601-f21d1e4ca83840f9854929ec96e92ad1.jpg https://imagesdl.dealercenter.net/1024/768/202601-fa38835797b34f1ca973daac93942698.jpg https://imagesdl.dealercenter.net/1024/768/202601-08d23daec76b4655ad5a15209c3dcc10.jpg https://imagesdl.dealercenter.net/1024/768/202601-deae0d50c8724633b57565459ebf1759.jpg https://imagesdl.dealercenter.net/1024/768/202601-d8f2132f34ac4dc19aa496bac815d67d.jpg https://imagesdl.dealercenter.net/1024/768/202601-a8f26090a335425b8ee5b8480614c0de.jpg https://imagesdl.dealercenter.net/1024/768/202601-7b06ed2545f944ed895efdaea0d0b36a.jpg https://imagesdl.dealercenter.net/1024/768/202601-a76a1f48d69f4bc5a3e66c4b384bf89f.jpg https://imagesdl.dealercenter.net/1024/768/202601-0375311ea27245788f06fdae0619714a.jpg https://imagesdl.dealercenter.net/1024/768/202601-743f26710be640ef850b6758a206b914.jpg https://imagesdl.dealercenter.net/1024/768/202601-6bd9de6ac99247938e309102146c91a7.jpg https://imagesdl.dealercenter.net/1024/768/202601-1fc004c7ef294472ad09e491f07be4fc.jpg https://imagesdl.dealercenter.net/1024/768/202601-cefe8a7a093b4cb2b4be9b4ac486a739.jpg https://imagesdl.dealercenter.net/1024/768/202601-7adb826638c54e479cc4fbce97aededd.jpg https://imagesdl.dealercenter.net/1024/768/202601-c230937ab6c446a7bf1d211f32abad17.jpg,Lexus CT200hHybrid ride  gas saverNice looking car with upgradesElectronic  heated  black leather seats are very comfortableIt has sunroof and nice sound systemSport  eco  ev modesCan go over 40 mpgClean interior and exteriorVery well maintainedReady to go,Power Steering FWD Power Door Locks XM Satellite Fog Lights Daytime Running Lights Tilt & Telescoping Wheel Keyless Entry Power Windows Bluetooth Wireless Dual Air Bags F&R Side Air Bags 4-Cyl Hybrid 1.8 Liter CD/MP3 (Multi Disc) Air Conditioning Stability Control F&R Head Curtain Air Bags Automatic CVT Traction Control Knee Air Bags Power Seat Keyless Start AM/FM Stereo Alloy Wheels ABS (4-Wheel) Cruise Control Safety Connect,1/15/2026 5:45:41 PM
5NPE34AF1FH252410,2015,Hyundai,Sonata,Limited Sedan 4D,108220,8750,Blue,,Auto  6-Spd w/Shiftronic & Drive Mode Select,https://imagesdl.dealercenter.net/1024/768/202601-daa205ae7b644e88b16ce250e7f1334e.jpg https://imagesdl.dealercenter.net/1024/768/202601-8a7efbf52ca54aecbf84bd4a27fb461a.jpg https://imagesdl.dealercenter.net/1024/768/202601-9ffa82890a784985b69b26b532ef02f4.jpg https://imagesdl.dealercenter.net/1024/768/202601-e0fbdb6bf6b24be4887947b65b1de3f6.jpg https://imagesdl.dealercenter.net/1024/768/202601-a19cba1d786f404ebd80c990fe248ab0.jpg https://imagesdl.dealercenter.net/1024/768/202601-058d5a568b734ba9a1efbb74f3edfda5.jpg https://imagesdl.dealercenter.net/1024/768/202601-e58a2c539cd9451c9f399a17d7b8fbbe.jpg https://imagesdl.dealercenter.net/1024/768/202601-4d21e771aea0475791b2f17bff6c50ad.jpg https://imagesdl.dealercenter.net/1024/768/202601-8b141fee4e1e4b95bf3a38e24024f2de.jpg https://imagesdl.dealercenter.net/1024/768/202601-76c5e53335bf4802acc28998d8992a85.jpg https://imagesdl.dealercenter.net/1024/768/202601-40e9070493f649eaa4817e6b1e86acc7.jpg https://imagesdl.dealercenter.net/1024/768/202601-b35a109712fa46daa6cfcd2592d33f18.jpg https://imagesdl.dealercenter.net/1024/768/202601-dd0215a6723d45b2a0503f6529b443ff.jpg https://imagesdl.dealercenter.net/1024/768/202601-4b855e13ae554eadb99d5e664924aaca.jpg https://imagesdl.dealercenter.net/1024/768/202601-745b34378b674ca6af2169b715580570.jpg https://imagesdl.dealercenter.net/1024/768/202601-9ffb402684f7415f92360dcbce6572b8.jpg https://imagesdl.dealercenter.net/1024/768/202601-c25e4c6886d0473d9a5ed04c62931e28.jpg https://imagesdl.dealercenter.net/1024/768/202601-86d9e908f0394349ba0abe40ea063261.jpg https://imagesdl.dealercenter.net/997/768/202601-940728c9adaa4af089006303f741be64.jpg,2015 Hyundai Sonata LimitedSharp looking carClean titleHeated and cooled leather seatsHeated steering wheelSunroof  BluetoothNavigation and back up camPush start  cruise controlClean interior and exterior,Power Windows Electronic Stability Control Power Steering Knee Air Bags Traction Control Side Air Bags 4-Cyl 2.4 Liter F&R Head Curtain Air Bags Leather Blind-Spot Detection AM/FM Stereo Power Door Locks Tilt & Telescoping Wheel Bluetooth Wireless Heated Seats ABS (4-Wheel) FWD Rear Spoiler Hill Start Assist Control Anti-Theft System Dual Air Bags Auto 6-Spd w/Shiftronic & Drive Mode Select Dual Power Seats Keyless Entry Air Conditioning Backup Camera Gen 1 Blue Link Telematics Premium Sound CD/MP3 (Single Disc) Keyless Start Cruise Control SiriusXM Satellite Alloy Wheels Daytime Running Lights,1/15/2026 5:20:52 PM
2T1BU4EE1BC717010,2011,Toyota,Corolla,S Sedan 4D,141740,7100,Gold,,Automatic  4-Spd w/Overdrive,https://imagesdl.dealercenter.net/1024/768/202601-8806e9d3917c4dc3b36320dc97698db0.jpg https://imagesdl.dealercenter.net/1024/768/202601-9846c2f71bcf4a6893f614148ba66302.jpg https://imagesdl.dealercenter.net/1024/768/202601-fc674d074f5e438288977fe58c37aaa4.jpg https://imagesdl.dealercenter.net/1024/768/202601-ab36b05f09bd4e3abec347a5b8cabaf5.jpg https://imagesdl.dealercenter.net/1024/768/202601-9981c513c0844855b6bc3f298a68a221.jpg https://imagesdl.dealercenter.net/1024/768/202601-b73dd3e4d8144078b44bf04e7f077dcf.jpg https://imagesdl.dealercenter.net/1024/768/202601-de72131b277244ed898fe60cf2f0e4a0.jpg https://imagesdl.dealercenter.net/1024/768/202601-e9f0c814683c44988f6c0990b53be36b.jpg https://imagesdl.dealercenter.net/1024/768/202601-08052061586848ae879272719f3505b9.jpg https://imagesdl.dealercenter.net/1024/768/202601-6b82b30b0b994d70a67a36f8c9852f11.jpg https://imagesdl.dealercenter.net/1024/768/202601-a205953ea7d842b883ec49a43422b867.jpg https://imagesdl.dealercenter.net/1024/768/202601-eeaf36f896f747d798dafb70ba369fd7.jpg https://imagesdl.dealercenter.net/1024/768/202601-5aab195c98c143e7aa7ba902067b7a07.jpg https://imagesdl.dealercenter.net/1024/768/202601-1b2cc8d12e524540b97760426ab5fbdf.jpg https://imagesdl.dealercenter.net/1024/768/202601-e9181986305d40cc952bb3a6c718b08f.jpg https://imagesdl.dealercenter.net/1024/768/202601-c35ce0d519f54c008d853f170bc3cb6a.jpg https://imagesdl.dealercenter.net/1006/768/202601-7a00c657b80c43dba785850820bbb4cb.jpg https://imagesdl.dealercenter.net/1020/768/202601-40d74e53581d4392b330d887bf51deac.jpg,2011 Toyota Corolla LEIn excellent shape1 Owner vehicleGood looking paintClean title ?Professionally detailed interior and exteriorGreat mechanical conditionNeeds nothingNo warning lights on the dashAlmost brand new winter tires are onReady to go,Power Windows FWD Air Conditioning Keyless Entry Power Door Locks 4-Cyl 1.8 Liter AM/FM Stereo Tilt Wheel ABS (4-Wheel) F&R Head Curtain Air Bags Anti-Theft System Dual Air Bags CD/MP3 (Single Disc) Power Steering Fog Lights Traction Control Daytime Running Lights Rear Spoiler Alloy Wheels Automatic 4-Spd w/Overdrive Cruise Control Stability Control Side Air Bags,1/14/2026 6:35:38 PM
